### ISSUE TITLE
goahead cannot transmit images

### ISSUE THREAD

**Issue by Isarhamster** [embedthis/goahead#181]
I try to load an image file from the webserver with
wget 192.168.104.8/favicon.ico
Transmitting images is actually delegated to the jstHandler, which cannot correctly handle file transfers, it loads the file actually but then comes to the following code, which is supposed to transmit the remainder of everything that has not been transmitted yet:

    /*
        Output any trailing HTML page text
     */
    if (last && *last && rc == 0)
    {
        websWriteBlock(wp, last, strlen(last));
    }

But this fails to transmit any data, as accidentally the first byte in the requested file is 0. (strlen would fail on the image as well).
On Wireshark, things look bad:
No.     Time           Source                Destination           Protocol Length Info
    709 10.900610000   192.168.104.8         192.168.134.17        HTTP     295    HTTP/1.1 200 OK  (image/jpeg)

Frame 709: 295 bytes on wire (2360 bits), 295 bytes captured (2360 bits) on interface 0
Ethernet II, Src: SiemensA_02:01:10 (08:00:06:02:01:10), Dst: Dell_30:17:ee (34:e6:d7:30:17:ee)
    Destination: Dell_30:17:ee (34:e6:d7:30:17:ee)
    Source: SiemensA_02:01:10 (08:00:06:02:01:10)
    Type: IP (0x0800)
Internet Protocol Version 4, Src: 192.168.104.8 (192.168.104.8), Dst: 192.168.134.17 (192.168.134.17)
Transmission Control Protocol, Src Port: 80 (80), Dst Port: 61318 (61318), Seq: 1, Ack: 199, Len: 241
Hypertext Transfer Protocol
    HTTP/1.1 200 OK\r\n
        [Expert Info (Chat/Sequence): HTTP/1.1 200 OK\r\n]
            [HTTP/1.1 200 OK\r\n]
            [Severity level: Chat]
            [Group: Sequence]
        Request Version: HTTP/1.1
        Status Code: 200
        Response Phrase: OK
    Server: GoAhead-http\r\n
    Date: Wed Dec 31 23:59:59 1969\r\n
    Transfer-Encoding: chunked\r\n
    Connection: close\r\n
    Content-Type: image/jpeg\r\n
    Cache-Control: public, max-age=86400\r\n
    Pragma: no-cache\r\n
    Cache-Control: no-cache\r\n
    \r\n
    [HTTP response 1/1]
    [Time since request: 0.030580000 seconds]
    [Request in frame: 705]
    HTTP chunked response
        Data chunk (4 octets)
            Chunk size: 4 octets
            Data (4 bytes)

0000  ff d8 ff e0                                       ....
                Data: ffd8ffe0
                [Length: 4]
            Chunk boundary
        End of chunked encoding
            Chunk size: 0 octets
        \r\n
    [Expert Info (Note/Malformed): HTTP body subdissector failed, trying heuristic subdissector]
        [HTTP body subdissector failed, trying heuristic subdissector]
        [Severity level: Note]
        [Group: Malformed]

I tried to put jstHandler behind fileHandler in the handler chain, but that does not solve the correct handling of files.

**Comment by Isarhamster** [comment]
Solved - misconfigured routing commands (duplicate entry)
